name,location,about,email,phone
ATG Europe,"Noordwijk, Netherlands","ATG Europe prides itself in employing Europe’s brightest minds, and for the last 40 years we have been a key player in delivering engineering services to the European space sector.
",contactus@atg-europe.com,+31 (0) 71 5795 500
Telespazio VEGA UK,"Capability Green, Luton LU1 3LU, UK","Telespazio VEGA UK is a dynamic and experienced consulting, technology and engineering services business based in Luton, UK. Following our merger into the Telespazio Group in 2011 we now have access to a vast array of world leading facilities and services, which we provide both within the UK and to our export markets. With a strong history in the European space arena starting in 1978, we have rich relationships across the space industry, with staff working closely with the European Space Agency (ESA) on programs and projects for over 35 years. ",careers@telespazio.com,+44 (0)1582 399000
Leafspace,"Lomazzo CO, Italy",Tailored services for microsatellites.  Leaf space was born in 2014 from a group of young engineers.,info@leaf.space,+39 02 36714624
Oxford Space Systems,"Didcot OX11 0QR, UK","Oxford Space Systems is an award-winning space technology business that's pioneering the development of a new generation of deployable structures that are lighter, less complex and lower cost than those in current commercial demand.",explore@oxfordspacesystems.com,+44 (0)1235 567 999
Zero 2 Infinity,"Marie Curie, 2, Nave 14, 08210, Barberà del Vallès, Barcelona, Spain","We are building a brighter future in which access to Space is frequent, affordable, secure and reliable for everyone. Our mission: enable people with a project and a passion to place themselves above the Earth in order to collect rich data, take high definition images, manage communications and more, much more.",marta.lebron@zero2infinity.space,+34 938 546 551
EUMETSAT,"Eumetsat Allee 1, 64291 Darmstadt, Germany","EUMETSAT is Europe's meteorological satellite agency. Our purpose is to gather accurate and reliable satellite data on weather, climate and the environment around the clock, and to deliver them to our Member and Cooperating States, to our international partners, and to users world-wide.",recruitment@eumetsat.int,+49 6151 807 7
Solenix GmbH,"Bornstrasse 3, 4616 Kappel, Switzerland","Solenix is a privately owned, independent and internationally active company providing engineering and consulting services in the space market. We have a track record of successful projects carried out with ESA, EUMETSAT, national space agencies and various aerospace companies, and have activities outside the aerospace market. In the software engineering domain, we are specialized in the implementation of distributed system and client applications, applying modern technologies and with a focus on the provision of performing, robust and light solutions.",career@solenix.ch,+41 62 216 35 02
ISIS - Innovative Solutions In Space,"Motorenweg 23, 2623 CR Delft, Netherlands","ISIS – Innovative Solutions In Space BV is a vertically integrated small satellite company, focused on providing high value, cost effective space solutions by making use of the latest innovative technologies. The company is focused on nanosatellites in the range of 1 to 30 kilograms. As one of Europe’s leaders in the nanosatellite domain, ISIS offers contract research, innovative small satellite parts, sub-systems and platforms as well as turnkey space solutions to a broad range of customers for small satellite missions and applications. ISIS supports nanosatellites throughout their lifecycle and as such is an active player in the domains of system level testing, launch services and operations of nanosatellites. 

Based in the Netherlands, ISIS employs over 75 specialist employees, all of which have a background in space technology and engineering, and operates from its main site on the high tech campus of Delft. At this site, ISIS also has its assembly, integration and test facilities that include a class 10,000 (ISO 7) integration cleanroom and a broad range of (environmental) test equipment and  development labs. In addition, ISIS has a development branch office in South Africa, in Somerset West and the company has an international network of partners and reseller agents. ",info@isispace.nl,+31(0)152569018
Rippleaerospace,"Vestre Strandgate 19B, 4611 Kristiansand, Norway","Ripple Aerospace is an Norwegian Aerospace startup designing, manufacturing and launching advanced oceanic cargo rockets. Inspired by NASA’s Sea Dragon program and Norway’s maritime heritage, Ripple’s team has been developing the Sea Serpent rocket class since 2014 and established Ripple Aerospace in 2016 to commercialize the first oceanic launch system. Our aim is to bring to market a reusable, mobile and mass produced rocket capable of being launched in any maritime environment around the global.

The Sea Serpent team is comprised of a diverse group of rocket scientists, engineers, shipbuilders and space operators from companies in Norway, United States, and Australia with the unifying goal of developing Sea Serpent rockets. ",kristoffer@rippleaerospace.com,(+47) 90569963
SpaceVR,"San Francisco, CA, USA","SpaceVR was started to transform productivity and enhance our perspective of our place in the universe using Virtual Reality (VR). Our first product - literally launching in Q4 of 2017 is Overview 1, a 3U CubeSat that transmits 360 degree video from outside of the International Space station to clients on Earth enabling everyone to experience the “Overview Effect” - a cognitive shift in awareness, reported by some astronauts and cosmonauts during spaceflight, often while viewing the earth from orbit or from the lunar surface. It explains the life changing experience gained from seeing first-hand the reality of the Earth in space. SpaceVR's second product Human builds upon this VR infrastructure to enable space settlement via increased human capability and job productivity on Earth.",blaze@spacevr.co,4159103307
Gilmour Space Technologies,"Brisbane QLD, Australia","We are a rocket company focused on small satellite delivery to LEO, and eventually exploration beyond LEO. Our focus is step by step milestone achievements with highly focused short term goals, and long term plans guiding us.  We believe great things can be done with small teams.  We are based in Brisbane and Singapore.  We work closely with a number of universities in Australia and Singapore. ",info@gspacetech.com,61755492370
GMV,"Tres Cantos, Madrid, Spain","GMV (www.gmv.com)is a privately owned technological enterprise group with an international presence employing more than 1.500 staff. Founded in 1984, GMV mainly operates in eight large sectors for both public and private organizations: Aeronautics, Space, Defense, Health, Security, Transportation, Telecommunications and Information Technologies.

GMV currently runs 8 work centers in Spain and offices in France, Germany, India, Malaysia, Poland, Portugal, Romania, USA, Colombia and United Kingdom.

We recruit and hire excellent engineers, and encourage innovation, technical excellence and continuing education. Our engineers regularly present papers at technical conferences, continue their education (more than 85% have a master’s degree), and we re-invest more than 12% of budget in IR&D projects. This striving for excellence, innovation and flexibility is a major part of our culture. We provide very competitive compensation, attractive benefits, and a great work environment with lots of opportunities for professional growth.

 
",jobs@gmv.com,+34918072100
AKKA Technologies,"Riesstraße 14, 80992 München, Germany","As a consulting and engineering Group and European leader in the mobility segment, AKKA Technologies operates in 20 countries through 21 centers of excellence. Our goal is to offer you the best in service and expertise.

Driven by innovation and a passion for technologies, AKKA Technologies combines an entrepreneurial spirit with a visionary strategy. Our strength is that we understand the challenges our clients face. We assist them throughout the product development process, no matter how complex their visions are. Our remarkable positioning with our in-house research center AKKA Research and our unique Franco-German axis qualifies us to be a leader on the global market.

For over 25 years, AKKA Technologies has supported its space clients with a global offer that encompasses the entire space sector through a multi-skilled expertise within a single company. This space engineering services can be offered through technical assistance or work packages, thanks to our European network of local agencies.",kontakt@akka.eu,+49 89 4805808 - 0
Deimos Imaging,Spain,"Deimos Imaging, a subsidiary of UrtheCast Corp. (Canada), is a private Spanish company headquartered in Tres Cantos (Madrid) and with satellite control and processing facilities in Boecillo (Valladolid) and Puertollano (Ciudad Real).
Deimos Imaging, one of the world leading satellite imagery provider, owns and operates the DEIMOS-1 and DEIMOS-2 satellites. 
",cv@deimos-imaging.com,
Astrobotic Technology Inc.,"Pittsburgh, PA, USA","Astrobotic Technology Inc. is a lunar logistics company that delivers payloads to the Moon for companies, governments, universities, non-profits, and individuals. The company’s spacecraft accommodates multiple customer payloads on a single flight, offering flexibility at an industry-defining low price of $1.2 million per kilogram. Astrobotic is an official partner with NASA through the Lunar CATALYST program, has 23 prior and ongoing NASA contracts, a commercial partnership with Airbus DS, a corporate sponsorship with DHL, 11 deals for its first mission to the Moon, and 110 customer payloads in the pipeline for upcoming missions.  Astrobotic was founded in 2007 and is headquartered in Pittsburgh, PA.",contact@astrobotic.com,412-682-3282
Vector,"824 E 16th St, Tucson, AZ 85719, USA",Vector is a disruptive innovator that connects space startups and innovators with affordable and reliable space access. Vector has a BIG vision to reshape the multi-billion launch market and combines dedicated low-cost micro satellites launch (Vector Launch) AND software defined satellites (Galactic Sky) to dramatically increase access and speed to orbit.,info@vector-launch.com,888-346-7778
QinetiQ Space,"Kruibeke, Belgium","QinetiQ is a company of scientists and engineers committed to listening, understanding and responding to our customers' needs. This enables us to use our depth of experience and our unique science and engineering expertise to equip them with powerful solutions to their most pressing challenges.

As the space industry continues to grow rapidly there are huge opportunities for our customers, particularly for critical infrastructure and national security. We are one of Europe's leading space system integrators, demonstrating applications that have never been implemented before. We build, launch and operate complex space infrastructure and our technical expertise and unique technologies enable us to deliver flexible and customised solutions, ensuring our customers' future advantage.

6,000+ knowledgeable workers - Our scientists, engineers, technicians & business people come from a remarkable range of disciplines. We are an independent provider of impartial technology-based advice, test and evaluation with global revenues, in the year to 31 March 2017, of £783.1m. With major facilities at Farnborough, Boscombe Down, Malvern, Portsdown and Haslar, we are one of the UK’s largest research and technology organisations. As a key supplier to the Ministry of Defence, we’re working on over 1,000 defence contracts at any one time. We hold more than 1,500 granted patents and have 1,000 patents pending.",,
DLR GfR mbH,"Oberpfaffenhofen, 82234 Weßling, Germany",We’re the DLR Space Applications Institute mbH – the DLR GfR for short. <br />,recruiting@dlr-gfr.de,
Atlas Space Operations,"Traverse City, MI, USA","The ATLAS network provides affordable cloud based solutions for space access in the rapidly growing global space market. Our network utilizes both ATLAS owned and cooperative antennas to provide our users S, X, and UHF band coverage and to command, control, receive telemetry and data from spacecraft. Built around the ATLAS Freedom software platform, our team has developed a proprietary way to cut costs, and efficiently schedule all of our customers.",info@atlasground.com,877.392.8527
ispace EUROPE S.A.,"Luxembourg City, Luxembourg","ispace is a private lunar exploration company whose vision is to expand and sustain humanity’s presence in space by utilizing resources available on the Moon. ispace was a Google Lunar XPRIZE finalist and its 4kg SORATO rover won the XPRIZE mobility milestone award. In addition to rovers, ispace is developing lunar landers with two missions already scheduled for launch in 2022 and 2023.",info@ispace-inc.com,
Infostellar,"Tokyo, Japan","Infostellar is a space communications infrastructure firm, developing the world’s only cloud-based satellite antenna sharing platform: StellarStation. By lowering costs and increasing transmission time, Infostellar empowers satellite operators to improve the quality of their service and expand potential business. Founded in 2016, Infostellar is headquartered in Tokyo, Japan.",info@istellar.jp,
CALLISTO,"12 Avenue de Bordé Blanche, 31290 Villefranche-de-Lauragais, France","Callisto's main office is located near Toulouse, France where we have laboratories equipped with radiofrequency instruments and cryogenic test facilities. Callisto also has engineers working in Germany, Italy and UK.",admin@callisto-space.com,05 61 800 807
SkyWatch,"Waterloo, ON, Canada","SkyWatch is on a mission to make satellite data accessible to the world. Every day, trillions of pixels are captured by satellites orbiting our planet. With new applications for this data being discovered every week, the demand for this imagery is increasing across many industries. However, the current process for purchasing satellite imagery is tedious and time-consuming. We experienced this problem first hand and, after weeks of trying to find the right data, we decided to come up with our own solution.

Utilizing our past experience in building NASA-award winning software (called Supernova), our team is developing SkyWatch EarthCache™. We believe that providing a singular point to discover and access the world’s remote sensing datasets will bring amazing change to geospatial analytics. This mission isn’t about us. It’s about you. We want to make it easy for you to monitor the progress of crops, predict the markets, track ship and airplanes, measure global warming, or create other game-changing applications. Our goal is to be the leading provider of data and intelligence from space.",dexter@skywatch.co,
Neptec Design Group Ltd.,"Kanata, Ottawa, ON, Canada","Neptec Design Group produces electro-optical and electro-mechanical systems for mission critical space applications. We are a world class supplier of high performance intelligent LIDAR and an innovator in the world of vision systems. In our nearly thirty year history, Neptec has contributed critical systems to some of the most demanding space exploration missions and built a reputation for making things work in challenging environments. Neptec Design Group has operations in Canada, the USA and the UK and is ISO 9001 certified",careers@neptec.com,613-599-7602
GomSpace,"Langagervej 6, 9220 Aalborg Øst, Denmark","GomSpace is a globally leading designer, integrator and manufacturer of high-end nanosatellites for customers in the academic, government and commercial markets. Our positions of strength include systems integration, nanosatellite subsystems and advanced miniaturised radio technology. Our international team is devoted to understanding our customers' requirements and deliver flawlessly. We are listed in Stockholm (GOMX), headquartered in Denmark and we service our customers in more than 50 countries. ",info@gomspace.com,
Spire,"San Francisco, Boulder, Glasgow, Singapore, Luxembourg","Spire is a satellite-powered data company that tackles the world’s most unpredictable business challenges with truly global data solutions. By providing unique data from any point on Earth, every hour, Spire offers a competitive advantage for organizations that require insight into areas such as global trade, weather, shipping and supply chain, illegal fishing, and maritime domain awareness.
",,
Sky and Space Global,"London, UK","Sky and Space Global (UK) Ltd - Our mission is to provide affordable voice, data, and instant messaging services - 
To Anyone, Anywhere, Anytime.
Company Number 9887327",Roee@Skyandspace.global,442031502789
PLD Space,"Elche, Alicante, Spain",PLD Space is the European rocket company developing a family of reusable microlaunchers to provide suborbital and orbital launch services to small satellites and payloads.,career@pldspace.com,0034965063139
Loft Orbital,"San Francisco, CA, USA","Loft Orbital offers an innovative space leasing service, enabling greater access to low earth orbit. We are a diverse, international and fast growing team based in San Francisco. In 2017, we raised a $3.2M from leading Silicon Valley investors and strategic partners; now we are rapidly building the team to support our vision of making space simple! ",alex@loftorbital.com,410-382-5050
University of Luxembourg,"Belval, Esch-sur-Alzette, Luxembourg",We are running the Space Resources Master Program at the heart of the strategy of Luxembourg to position itself competitively in the space industry. ,Ross.horne@uni.lu,+352661923966
European GNSS Agency,"Prague, Czechia","Space is the new technological revolution and it is changing the way we live, work  and play. GSA’s core mission is to ensure that European Citizens get the most out of Europe’s satellite navigation programmes<br />",jobs@gsa.europa.eu,
HCCR K.K.,Japan,<b>HCCR is a Tokyo-based boutique executive search firm that specializes in critical talent acquisition for drone and VTOL companies.</b><br /><br /><br />,,
ICEYE,"Espoo, Finland","We are a Finnish based international New Space company with employees from roughly 40 countries and subsidiaries in the US, UK and Poland. Our team is a tight-knit group of experts from a range of areas including engineering, software development, and radar technology. We’re innovative, driven, and strive for excellence in everything we do. We don’t listen to people who say it can’t be done: we go and do it!<br /><br /><br />",,
AstroAgency,United Kingdom,,,
Stellar Amenities,"Los Angeles, 91401, USA",,,
Bradford Deep Space Industries,Luxembourg / United States,"Deep Space Industries, now part of the Bradford Space group, is pioneering the development of technologies to enable lower-cost missions throughout the inner Solar System. ",,
MethaneSAT LLC,"301 Congress Ave #1300, Austin, 78701, USA","MethaneSAT, LLC, an affiliate of Environmental Defense Fund (EDF) is launching a new, high performance, purpose-built satellite--MethaneSAT--to map and measure oil and gas methane emissions worldwide, with the potential to assess emissions from the full range of man-made sources. The satellite will enable us to gather methane emissions data on a global scale and with data from other sources, locate and quantify these emissions.  Data from MethaneSAT will help EDF reduce methane emissions by 45% by 2025 and holds the potential to help reduce the temperature of our planet by as much 0.5 degrees C by the end of the century.  This could be the most impactful environmental project yet conceived.<br /><br /><br />",,
GAF AG,"Arnulfstraße 199, Munich, 80634, Germany","<b>GAF AG</b> is a global company with leading expertise in the development of geo-information products and services. Since its founding in 1985, the company has developed a broad geoscience portfolio. With more than 200 highly qualified employees we offer geo-data, data processing, geographic information systems, database applications, software development, consulting and project management as well as development assistance.<br />Besides our home markets in Germany and Europe, <b>GAF</b> is internationally active - having an impressive track record of more than 1000 projects in 100 countries worldwide. <b>GAF</b> works for industry and private sector, for international institutions and development banks, national authorities and clients. <b>GAF</b> is headquartered in Munich, Germany with a branch in Neustrelitz (North of Berlin). <br />",,
The University of Auckland,"Auckland, 1010, 49 Symonds St","The University of Auckland is New Zealand’s highest-ranked, research-intensive and comprehensive university. Recognised as one of the world’s leading entrepreneurial universities and with an established innovation and entrepreneurial ecosystem, the University is committed to growing its capabilities and impact and continuing to attract high performing and motivated students across all disciplines. Our standing as New Zealand's leading tertiary institution is the result of our people. With 6,000 staff and 42,000 students, the University of Auckland is a large and complex organisation, with an absolute commitment to academic excellence.<br />The Faculty of Engineering’s undergraduate and postgraduate student numbers continues to grow with our The multi-disciplinary Newmarket Campus opened in 2015 and our purpose-built Engineering building which was opened earlier this year help our academics and students to pave the way for innovation and research excellence across many of our engineering disciplines.<br />Te Pūnaha Ātea/<a href=""https://space.auckland.ac.nz/"">The Auckland Space Institute</a> is a multidisciplinary centre of expertise covering a variety of topics ranging from spacecraft engineering to astrophysics, to remote sensing and applications of space technologies. Our work will include research and development working with industry, academia and other institutions, with the aim to grow the local space sector, as well as run educational activities at undergraduate, post-graduate and post-doctoral levels. We are now seeking an experienced specialist in mission operations.<br /><br /><br />",,
DLR - German Aerospace Center,"Cologne, Germany (headquarters)","<b>The German Aerospace Center (DLR) is the national aeronautics and space research centre of the Federal Republic of Germany. </b>Its extensive research and development work in aeronautics, space, energy, transport, security and digitalisation is integrated into national and international cooperative ventures. In addition to its own research, as Germany’s space agency, DLR has been given responsibility by the federal government for the planning and implementation of the German space programme. DLR is also the umbrella organisation for one of the nation’s largest project management agencies.<br /><br />DLR has approximately 8900 employees at 27 locations in Germany: Cologne (headquarters), Augsburg, Berlin, Bonn, Braunschweig, Bremen, Bremerhaven, Cochstedt, Cottbus, Dresden, Goettingen, Hamburg, Hanover, Jena, Juelich, Lampoldshausen, Neustrelitz, Oberpfaffenhofen, Oldenburg, Rheinbach, Stade, St. Augustin, Stuttgart, Trauen, Ulm, Weilheim and Zittau. DLR also has offices in Brussels, Paris, Tokyo and Washington D.C.<br /><br />DLR’s mission comprises the exploration of Earth and the Solar System and research for protecting the environment. This includes the development of environment-friendly technologies for energy supply and future mobility, as well as for communications and security. DLR’s research portfolio ranges from fundamental research to the development of products for tomorrow. In this way, DLR contributes the scientific and technical expertise that it has acquired to the enhancement of Germany as a location for industry and technology. DLR operates major research facilities for its own projects and as a service for clients and partners. It also fosters the development of the next generation of researchers, provides expert advisory services to government and is a driving force in the regions where its facilities are located.",,
Advanced Computer Systems ACS-D GmbH,"Löwenstrasse 4-8, Offenbach am Main, 63067, Germany","<strong></strong><b>ACS-D</b> is a German subsidiary of the <b>Exprivia </b>international group. With know-how and experience gained over 30 years, Exprivia is currently active in the Banking &amp; Finance, Telco &amp; Media, Energy &amp; Utilities, Public Sector, Manufacturing &amp; Distribution, Healthcare and Aerospace &amp; Defence areas.",acs-d@exprivia.com,
Stealth Startup,"Strasbourg, 67400, France","We are a European space startup, founded by a team of international space experts. Our product is a digital platform that transforms the tools and engineering processes used to manage space missions. This is a first-of-its-kind product, at the crossroad of cloud &amp; software technologies, new space engineering concepts, digital transformation, and innovative commercial and delivery models. We are still operating in stealth mode so details are not public, but we will tell you more, face-to-face, during the interview.<br /><br />We are currently a small team of 10. With funding secured, we now want to scale it up. We are looking for top engineering talents to help us digitalize the space industry. Join us!<br /><br />The company is based in Strasbourg, France, a beautiful and vibrant city that offers an amazing quality of life. Strasbourg is a highly international city at the crossroads of France, Germany, and Switzerland. It offers a rich culture, easy access to nature, wonderful gastronomy, and a fast-growing startup scene.<br />",,
Space Talos LTD,"35 Kingsland Rd, Hackney, London E2 8AA, United Kingdom",,info@spacetalos.co.uk,
