name,location,about,email,phone
STFC,"Harwell, Didcot OX11, UK","Helping build a globally competitive, knowledge-based UK economy
We are a world-leading multi-disciplinary science organisation, and our goal is to deliver economic, societal, scientific and international benefits to the UK and its people – and more broadly to the world. Our strength comes from our distinct but interrelated functions:

Universities: we support university-based research, innovation and skills development in astronomy, particle physics, nuclear physics, and space science
Scientific Facilities: we provide access to world-leading, large-scale facilities across a range of physical and life sciences, enabling research, innovation and skills training in these areas
National Campuses: we work with partners to build National Science and Innovation Campuses based around our National Laboratories to promote academic and industrial collaboration and translation of our research to market through direct interaction with industry
Inspiring and Involving: we help ensure a future pipeline of skilled and enthusiastic young people by using the excitement of our sciences to encourage wider take-up of STEM subjects in school and future life (science, technology, engineering and mathematics)
We support an academic community of around 1,700 in particle physics, nuclear physics, and astronomy including space science, who work at more than 50 universities and research institutes in the UK, Europe, Japan and the United States, including a rolling cohort of more than 900 PhD students.

STFC-funded universities produce physics postgraduates with outstanding high-end scientific, analytic and technical skills who on graduation enjoy almost full employment. Roughly half of our PhD students continue in research, sustaining national capability and creating the bedrock of the UK’s scientific excellence. The remainder - much valued for their numerical, problem solving and project management skills - choose equally important industrial, commercial or government careers.

Our large-scale scientific facilities in the UK and Europe are used by more than 3,500 users each year, carrying out more than 2,000 experiments and generating around 900 publications. The facilities provide a range of research techniques using neutrons, muons, lasers and x-rays, and high performance computing and complex analysis of large data sets.

They are used by scientists across a huge variety of science disciplines ranging from the physical and heritage sciences to medicine, biosciences, the environment, energy, and more. These facilities provide a massive productivity boost for UK science, as well as unique capabilities for UK industry.

Our two Campuses are based around our Rutherford Appleton Laboratory at Harwell in Oxfordshire, and our Daresbury Laboratory in Cheshire – each of which offers a different cluster of technological expertise that underpins and ties together diverse research fields. 

The combination of access to world-class research facilities and scientists, office and laboratory space, business support, and an environment which encourages innovation has proven a compelling combination, attracting start-ups, SMEs and large blue chips such as IBM and Unilever.

We think our science is awesome – and we know students, teachers and parents think so too. That’s why we run an extensive Public Engagement and science communication programme, ranging from loans to schools of Moon Rocks, funding support for academics to inspire more young people, embedding public engagement in our funded grant programme, and running a series of lectures, travelling exhibitions and visits to our sites across the year.

Ninety per cent of physics undergraduates say that they were attracted to the course by our sciences, and applications for physics courses are up – despite an overall decline in university enrolment.",,
TTTech Computertechnik AG,"Vienna, Austria","TTTech Computertechnik AG is the technology leader in robust networked safety controls. Our solutions and best-in-class products improve the safety and reliability of networked computer systems and are used in various industries such as automotive, aerospace, off-highway, energy production, railway and industrial.",career@tttech.com,0043158534340
Maana Electric,"Luxembourg City, Luxembourg","Maana Electric is an innovative startup which is using space industry technologies for the production of solar panels on Earth and in Space. Maana aims to produce better and emission free solar panels for Earth to accelerate the transition to clean & sustainable energy sources. In the long term Maana aims to produce solar panels on the Moon and other celestial bodies; using its technologies for the advancement of the human race beyond our planet. The founding team of Maana stems from the space industry and is made up of successful engineers, scientists and entrepreneurs.
",hr@maanaelectric.com,
IMMEDIA,"Madrid, Spain","Immedia is a company formed by Software Engineers, with a long trajectory in the execution of technological projects carried out in organizations of the Space sector, covering several fields of management:
- Project Portfolio Management (PPM)
- Information Management (IM)
- Knowledge Management (KM)

We actively support the professional and personal development of our people, promoting an efficient and flexible work environment, and reflecting it to our clients in every service we provide.

As a qualified partner of the European Space Agency (ESA-ESOC) in the domain of Information Technology, IMMEDIA demonstrates that being a flexible, committed and specialized organization, provides solutions with high added value even in complex work environments.",rrhh@immediait.com,+34 638012005
Nitrexo,"Midleton, Co. Cork, Ireland","
Nitrexo’s Expertise

Thermal engineering, particularly in the space industry, is the expertise of Nitrexo, a start-up company based in Ireland. The company provides engineering and consultancy services, as well as digital solutions, thermal analysis reports, and various space products, to its clients.

Nitrexo’s competence involves using ESATAN-TMS® for conducting thermal analyses on space systems and sub-systems prior to the implementation of the thermal design. This ensures that the device or product that undergoes analysis and testing will function effectively under certain space conditions.

In addition, the company specializes in payloads, system level, solar panels, mechanisms, instruments, antennas, sensors, mirrors, electronics, optoelectronics devices for satellites, rockets, microelectronic components, and ground support equipment. Clients are also assured of receiving a thermal analysis reports on their projects.

Having completed projects for the European Space Agency and QinetiQ, Nitrexo’s strengths include running tests and verifications, as well as the integration of improvements to various engineering designs and processes.

Nitrexo’s Mission and Vision

Nitrexo believes in democratic ways of doing things to achieve competence and expertise, particularly in the field of space thermal engineering. In this regard, it uses education as an effective platform and tool for enhancing people’s capabilities.

Through its digital solutions, it aims to provide any interested party--whether business entities or individuals--equal access to educational and skills enhancement materials and applications that will help them create and innovate effectively.

Knowledge Management

Nitrexo guarantees that its training programs are not limited only to the transfer of theoretical knowledge to thermal engineers but that they also teach them how to accurately apply such knowledge in their field of work. Thus, Nitrexo trainings are designed to ensure a delightful user experience.
",info@nitrexo.com,
OneWeb,"Tysons, VA, USA","OneWeb's mission is to enable Internet access for everyone, everywhere.  We want to see the next generation even more connected than the last, and to create opportunities for people today to access the opportunities made possible through the Internet.  To fulfill our mission, OneWeb is revolutionizing the satellite industry and building a global communications network with a constellation of Low Earth Orbit satellites that will provide connectivity to people around the world.  OneWeb is creating business solutions for Broadband, Government and Cellular Backhaul.  It’s high speed, low latency  network will offer game-changing Mobility solutions to industries that rely on global connectivity, such as Aviation, Maritime, Automotive, Trains, and more.",csilva@oneweb.net,571-336-7190
AGC,"Oklahoma City, USA",,,
EMSISTI Space Systems & Tecnology,"Parque Tecnológico de São José dos Campos. Estrada Dr. Altino Bondensan, 500 - Eugênio de Melo, São José dos Campos - SP, 12247-016, Brazil","The EMSISTI is a Brazilian company founded in 2010 dedicated to the design, development, verification, validation and integration of critical systems for applications in space, automotive, aeronautical and financial platforms.",emsisti@emsisti.com.br,+5512981486500
Gooch & Housego,"Torquay, UK","Gooch & Housego is a global leader in photonics technology. Our expertise extends from research through the development of prototypes to volume manufacturing and enables innovation and effective manufacturing in the aerospace & defence, industrial, life sciences and scientific research (big science) sectors. 
Our world-leading space photonics R&D group - based in Torquay, UK-  is spearheading the   development of  ground-breaking systems for communication and sensing to be deployed in next-generation laser-equipped satellite constellations and UAV swarms.      ",amcbride@goochandhousego.com,01460256474
Dinamico Aerospace,"Metropolitan City of Milan, Italy","Dinamico Aerospace is a leading supplier and broker of advanced aerospace products, service and support to commercial and government clients around the world. With 12 international offices and technical support staff located worldwide, Dinamico Aerospace serves as a critical link in the global aerospace supply chain.",sales@dinamico.space,390230323875
We are Quattro,"Bristol, UK","We have 30+ years combined experience recruiting into the Space sector.

We have knowledge of projects that comprise of design, build, launch, control, data and apps.

Already we have been involved in projects in the areas of AI and machine learning for rovers; Machine learning for Earth Observation data; Cubesat's utilising IoT; Cubesat design and launch; In orbit servicing; Complex mathematical modelling for satellite control; Complex optics; Advanced classification techniques for agriculture.... To name a few!

So far 100% of our customers would use us again and recommend us and our rating is 4.8 out of 5 (I guess nobody is perfect!!) Some example testimonials can be seen below.
",info@wearequattro.co.uk,0044 117 203 4444
CERN,"Geneva, Switzerland","Imagine taking part in the largest scientific experiment in the world. CERN needs more than physicists, engineers and technicians – if you’re a student or a graduate just starting your career, or are an experienced professional - whatever your field of expertise, CERN could be your next opportunity. CERN, Take Part!

CERN is a truly unique organisation. A genuine collaboration between countries, universities and scientists, driven not by profit margins, but by a commitment to create and share knowledge.
People here are part of immense scientific discoveries, answering some of life’s most complex questions and pushing the boundaries of understanding. Experts from every field come here to share in this ambition and the nature of this collaborative, international community creates a genuine atmosphere of trust. People are free to work creatively and to trust in, and rely on, their colleagues across the organisation.

History’s being made here – and the excitement is tangible, inspiring, overwhelming at times. It is the only place in the world that you can do this work in this way.",recruitment.service@cern.ch,
Terma Group,"Darmstadt, Germany","At Terma our people make the difference. We employ talented, dedicated people to deliver integration and engineering solutions that help meet aerospace, defense, and security challenges. We are continually looking for highly qualified candidates to join in contributing to our outstanding team. If you're looking for a career where your expertise can make a difference, look to Terma.",recruitment.de@terma.com,+49 6151 86005-0
Space Impulse,"London, UK","Space Impulse was founded with a mission to lower space industry costs and accelerate times to orbit on a global B2B e-marketplace platform. The platform applies the security, transparency, and standardization advantages of blockchain and smart-contract technology to streamline industry supply chain integration. By fulfilling this mission, the company will help to clear and widen the pathway linking Earth and space, and empower a thriving and expanding space industry ecosystem.",hr@spaceimpulse.com,
EUMETSAT,"Darmstadt, Germany","As an intergovernmental European Organisation, EUMETSAT has 30 Member States (Austria, Belgium, Bulgaria, Croatia, Czech Republic, Denmark, Estonia, Finland, France, Germany, Greece, Hungary, Iceland, Ireland, Italy, Latvia, Lithuania, Luxembourg, The Netherlands, Norway, Poland, Portugal, Romania, Slovakia, Slovenia, Spain, Sweden, Switzerland, Turkey and the United Kingdom).",bertrand.theodore@eumetsat.int,+4961518077
T4i Technology for Propulsion and Innovation Srl,"Padua, Province of Padua, Italy",We're a start-up that provides the space market with innovative propulsion systems and services and develop disruptive space technologies to answer demanding aerospace market requests: our mission is to satisfy the need of smart solutions for miniaturized satellites and small rockets. Key products are electric and chemical propulsion systems for in-space and launcher applications.,careers@t4innovation.com,049 927 1547
Adamant Composites,"Patras, Greece","Adamant Composites Ltd is an industrial SME working on high-tech applications of Advanced Materials and Structures supporting our International Customers with design, manufacturing and new technologies for their products. We are a dynamic Small Company based in Patras, Greece, offering our employees state-of-the-art engineering projects, flexible working hours, and stable working environment in a competitive package. Since 2012 that the company started we have been growing, eventually creating a team of 15 engineers and technicians. ",info@adamant-composites.gr,+302610931730
Philotech Systementwicklung und Software GmbH,"Taufkirchen, Germany","Philotech, your partner for engineering and consulting

Since more then 30 years, we have offered services covering the complete lifecycle of technical systems from concepts, design, development to customer services and certification to contribute to our customers' value creation.

We are operating in an international oriented infrastructure within Europe.

Our creative teams consist of highly qualified and motivated engineers who are facing the challenge of solving complex projects.

Philotech offers services across several industries as work packages, service contracts as well as temporary work. Highly specialized experts are developing complex solutions in close co-operation with our customers.",ralf.molzahn@philotech.de,+49 151 55 02 09 99
HyImpulse Technologies GmbH,"74239 Hardthausen am Kocher, Germany","HyImpulse is a New-Space start-up based in Hardthausen, Germany. HyImpulse was founded by 5 DLR employees with excellent experience in chemical and hybrid rocket propulsion as well as a good network in the international space industry. ",career@hyimpulse.de,+4915126577936
HE Space,"Flughafenallee 24, 28199 Bremen, Germany","HE Space Operations is a privately-owned company, operating internationally with offices in the Netherlands, Germany and the USA. HE Space Operations is specialised in personnel recruitment with its focus exclusively on space agencies and the space industry. Our recruitment team combines human resource competence with technical expertise in order to seek out highly educated and motivated professionals. Our current staff originate from all over Europe and beyond and possess a wide range of capabilities in engineering, science and general administration. 

In 2014, HE Space won the German Corporate Social Responsibility Award for Gender Diversity. We provide expert engineering, scientific, management and administration support to the main ESA establishments and to EUMETSAT. Our industry customers include Airbus Defence and Space, ArianeGroup, OHB Systems, DLR GfR, Thales Alenia, Rovsing, Jena-Optronik, TESAT Spacecom, IABG, STI Space tecdh and Mynaric. Our staff have made significant contributions to many of Europe’s most exciting space projects. 

Imprint: https://www.hespace.com/imprint",jobs@hespace.com,
Sitec a Belcan Company,"Bristol, UK","Established in 1951, Sitec is a privately owned engineering service company, providing engineering and recruitment solutions to many blue chip clients across a range of sectors including Aerospace, Nuclear, Defence and Petro-Chemical. 
With a reputation for technical excellence, we have a proven record of providing engineering support solutions to clients to meet their outsourcing needs and also offer tailored staffing solutions to provide clients with both temporary and permanent staff.",cdoyle@belcan.com,01179792396
Cosmic Futures,"Bristol, UK","Our vision is to solve the Space industry’s talent deficit, so that talent needs will be able to meet growth demands for future generations. We aim to do this by combining our disruptive ideas and industry experience in engineering, to provide you with a unique recruitment solution that is simple and effective. Whilst we are enabling individuals and businesses in the present, we are also investing in long term solutions by working alongside educational institutions to encourage the next generation to pursue of a career in the Space industry, paving the talent foundations of tomorrow.

Whether you are a start-up in the New Space market looking to expand, an established player in search of a specialist or an individual looking for a career change, we can help you reach success in your mission.",enquiries@cosmicfutures.space,0044 (0) 1173 705 745
Space Applications Services NV/SA,"1932 Brussels Area (St-Stevens-Woluwe), Belgium","Space Applications Services NV/SA Head Office is in Brussels, Europe with a subsidiary, Aerospace Applications North America Inc. in Houston, USA. Space Applications Services Belgium is EN 9100 certified.

We have recently celebrated 30 years of experience and success in the space business in developing systems for the European Space Agency (ESA), National Space Agencies, the aerospace industry as well as for the security markets industries.

The group is consistently growing, developing new strengths and capabilities: we work on some of the most demanding and challenging space projects, including the International Space Station, Orion, Dream Chaser, ExoMars and on some of the most advanced systems, Space Exoskeleton, Atomic Clock Ensemble in Space, Electromagnetic Levitator, Fluid Science Laboratory.
At the head office in Belgium we have laboratories, workshop and clean-room facilities. 

We are passionate about what we do and our group is characterised by an atmosphere of pride in our achievements, commitment and teamwork.
We are forward looking and engaged in the emerging market of Low Earth Orbit commercialisation with our International Commercial Experiment Cubes Service (an European first) and are developing a lunar rover as well as researching In Situ Resource Utilisation.",jobs@spaceapplications.com,+32(0)2 721 54 84
Blue Skies Space,"London, UK","We are pioneering a new model of building and operating satellite to offer science as a service direct to researchers in universities across the globe.  We are starting the detailed design of our first satellite, Twinkle, designed to research exoplanets and asteroids.  ",Philip.windred@bssl.space,07785387722
Serco Europe,"Germany, Netherlands, Spain, UK, Belgium (present in over 30 countries around the world)","The Serco Group is a FTSE 250 corporation with over 60,000 staff in 30 countries. Our strategy is to be a superb provider of public services, by being the best managed business in our sector. We are a focused business to government (B2G) business, specialising across five sectors: Defence, Justice & Immigration, Transport, Health and Citizen Services. ",space.careers@serco.com,+49 (0) 6151 812780
RHEA Group,"Wavre, Belgium","25 years of experience in the professional engineering service market. RHEA Group opens the world to the engineering services of tomorrow. RHEA Group’s background and roots are within space, and it has grown and expanded to other fields, including concurrent design, cloud computing, and security and crisis management.

RHEA Group employs scientist and engineers worldwide. The company has supported more than 100 spacecraft, covering space missions such as Rosetta, Mars Express, Copernicus, and Galileo with the Manufacturing and Operations Information System (MOIS). Top clients include the European Space Agency, Canadian Government, EUMETSAT, the European Commission, EBU, CERN, NATO, Belspo.

Headquartered in Belgium, RHEA Group also operates in Canada, Czech Republic, Italy, France, Germany, Spain, Switzerland, The Netherlands and the United Kingdom.",info@rheagroup.com,+32 10 48 72 50
Spacedarts,"Madrid, Spain",Spacedarts is a spacetech startup of mass production of micro launchers for small satellites to LEO.,eugene.k@spacedarts.space,+7-916-178-2732
Morehead State University,"Morehead, KY","Morehead State University (MSU) is a comprehensive public university with robust undergraduate and graduate programs, emerging doctoral programs, and an emphasis on regional engagement. MSU aspires to be the best public regional university in the South through prioritizing student success; outcomes; academic excellence; and rankings, reputation and regional responsiveness.
 
MSU is located in the foothills of the Daniel Boone National Forest in Rowan County, Kentucky. Founded in 1887 as Morehead Normal School, it was a private, church-supported institution known as “a light to the mountains.” In 1926, it became part of the state-supported system and was renamed Morehead State Normal School and Teacher’s College. An increase in enrollment and degree programs resulted in successive renaming as Morehead State College (1948) and its current designation as Morehead State University (1966).",humanresources@moreheadstate.edu,606-783-2097
FENTISS,"Valencia, Spain",We are a SME spinned-off from the Technical University of Valencia more than 10 years ago.<br />,rrhh@fentiss.com,+34 963 294 704
VHR,"London, UK","VHR is an international technical recruitment organisation providing solutions to the Aerospace & Aviation, F1 & Automotive, Engineering & Defence and Marine industries around the world.",maxwell.davies@v-hr.com,02077400042
Space Talos Ltd.,"London, UK",Space Τalos Ltd. is a deep tech startup that provides a practical active shielding solution for protecting the electronics of satellites against space radiation. ,info@spacetalos.co.uk,
GMV,"Madrid, Spain","GMV is a private-capital Spanish technological
business group trading on a worldwide scale.
Founded in 1984 it operates in eight main sectors:
Aeronautics, Space, Defense, Healthcare, Security,
Transport, Telecommunications, Information
technologies for the general government and major
companies.
GMV currently runs 8 work centers in Spain and
offices in France, Germany, India, Malaysia, Poland,
Portugal, Romania, USA, Colombia and United
Kingdom.",recruiting@gmv.com,
Celestia Technologies Group (CTG),"Noordwijk, Netherlands","Celestia Technologies Group is an international multi technology group based on innovation, investigation and development of high technology products key factors to a steady growth.

The individual companies of Celestia Technologies Group operate in the defence, space, wireless, governmental and medical segments offering state of the art products supported by an extensive background of R&D activities
",palmag@celestia-tech.com,+34 606 11 58 41
Malin Space Science Systems,"San Diego, CA, USA","Malin Space Science Systems (MSSS) designs, builds, and operates space camera systems for government and commercial aerospace customers.
",bgallo@msss.com,858-552-2650
Pixxel,"Bengaluru, Karnataka, India","Pixxel is a start-up working on building and launching a constellation of remote sensing small satellites for earth observation. Our satellites will provide global coverage as they beam down near-real-time information-rich satellite imagery like never before with images of every location on the planet, every 24 hours. The goal is to use this satellite data to provide actionable insights in agriculture, mining and a host of other applications.",contact@pixxel.co.in,+919952732660
QSR Consulting,"Lisbon, Portugal",QSR is a strategy consulting firm developing high-end solutions within human capital.,info@qsr.consulting,+351 211 359 758
