name,location,about,email,phone
Agnikul Cosmos,"IIT Madras, NCCRD, Chennai, 600036, India","Our Vision is to bring ""Space Within Everyone's Reach"" <br />We believe going to space shouldn’t be the hardest part of utilising, living in or working from space. So, we decided to design &amp; build a product that makes the earth-to-space journey as simple, as quick and as affordable as possible. <br />",,
University College London/ Mullard Space Science Laboratory,"Holmbury House, Dorking, RH5 6NT, United Kingdom","The Mullard Space Science Laboratory is located on its own campus in the beautiful Surrey Hills, surrounded by woodland. MSSL is the UK's largest university space research group. Space science is a discipline that demands highly innovative technologies and MSSL has an international reputation for excellence in this area. UCL was one of the first universities in the world to become involved in making scientific observations in space. Since MSSL was established in 1966, we have participated in over 40 satellite missions with the European Space Agency, NASA (US), Japan, Russia, China and India, and flown over 230 rocket experiments. The Department is family friendly and applications would be welcome from applicants seeking part-time opportunities. The Department has recently become an Institute of Physics Juno Practitioner. The aim of Project Juno is to recognise and reward physics departments, schools, institutes and organisations that can demonstrate they have taken action to address gender equality in physics and to encourage better practise for all staff.<br />",office@mssl.ucl.ac.uk,
Absolut System,"2 Rue des Murailles, Seyssinet-Pariset, 38170, France","ABSOLUT SYSTEM SAS has been established beginning 2010 by high skilled <strong>engineers with large experience and expertise in cryogenics</strong>. His objective is to <strong>ensure cryogenic engineering, development, design and commercialization of custom’s design equipment</strong> which can’t be found off the shelf. The long term experience and expertise of <strong>ABSOLUT SYSTEM’s experts makes the cryocooler one of the best example of the core business of the company</strong> with their development, manufacturing and their integration in high sensitivity detection systems, superconducting devices, and intermediate size helium, nitrogen or oxygen liquefiers.<br /><br /><br />",,
S.A.B. Aerospace s.r.o.,"Technická 2935/23, Brno, 61600, Czech Republic",We are a space company and we try to stretch the boundaries.  We are located in the Technology Park in Brno. We have developed and administrative offices in the TechNest building. A few meters away are our own ISO 8 laboratories.<br /><br /><br />,,
VEOWARE SPACE,"Jules Bordet, 13, Brussels, 1140, Belgium",,,
Bitpanda,"Vienna, Austria",,,
Infostellar,"Tokyo, 141-0031, Japan","Infostellar is an innovative SME looking to revolutionise the ground segment, democratising and adding flexibility to the way that operators access their satellites, through our cloud-based platform StellarStation.<br /><br />A Tokyo based start-up, we have spent the last four years building our product and solidifying our base in Japan, whilst simultaneously ensuring that we are also addressing the needs of the industry in Europe, where we established our base in London in 2019, as well as the USA, both of which will continue to be areas of interest to us for the remainder of 2020 and beyond. <br />Our focus in 2020 has been to continue growing our StellarStation platform to reach a wider range of satellite customers as well as to grow the ground stations that are a part of our network, as well as the growth of Infostellar.<br />",,
Officina Stellare,"Via della Tecnica 87/89, Sarcedo, 36030, Italy","Officina Stellare S.p.A. is an Italian SME headquartered in Sarcedo (Vicenza, Italy) and listed on the Alternative Investment Market (AIM) stock list of Borsa Italiana. Officina Stellare is leader in the realization of complex opto-mechanical instrumentation for ground, aerospace and space-based applications. The company can easily be referenced worldwide for its expertise in managing complex engineering projects, delivering complete turn-key custom designed optical systems. Officina Stellare is one of the fewest companies which can back on having the full production life cycle completely <i>in-house</i>. Flexibility, time to application, cost-effectiveness and a smart-thinking attitude of the structure, are at the base of Officina Stellare success. The in-house optical design capabilities and manufacturing facilities allow to execute in-house the full development  for  space and ground-based optical systems up to 1.6 m diameter aperture.<br />",info@officinastellare.com,
Luxembourg Institute of Science and Technology,"5, Avenue des Hauts-Fourneaux, Esch-sur-Alzette, L-4362, Luxembourg","The Luxembourg Institute of Science and Technology (LIST) is a Research and Technology Organization (RTO) active in the fields of materials, environment and IT. By transforming scientific knowledge into technologies, smart data and tools, LIST empowers citizens in their choices, public authorities in their decisions and businesses in their strategies. <br />",jobs@list.lu,
Made In Space Europe,"Luxembourg City, Luxembourg","We are an aerospace firm dedicated to providing industry-wide access to sophisticated, in-space, robotic arm solutions. Our vision for space is one where humans living and working there is commonplace. The technologies we're developing today are critical to humanity one day achieving its spacefaring dreams.",admin@madeinspaceeurope.com,
Thales Alenia Space UK,United Kingdom,,,
LIST,Luxembourg,,,
ONERA,"2 Avenue Edouard Belin, Toulouse, 31055, France","<p><b><span lang=""EN-US"" style=""font-size: 10.0pt;"">Office national d’études et de recherches aérospatiales (ONERA)</span></b><span lang=""EN-US"" style=""font-size: 10.0pt;""> is the French national aerospace researchcenter. It is a public research establishment, with 8 major facilities inFrance and about 2,000 employees, incl. 1,500 scientists, engineers &amp;technicians.</span><br/></p>",,
University College London,"London, United Kingdom",,,
adksmksamd aksmdksamda kmskad,"kdmksad askdmksa sd aksmdk, Krakow, 31-340, Sri-Lanka",,,
LiveEO,"Berlin, Germany","Everybody at LiveEO is passionate about the possibilities that arise from New-Space technologies. We strongly believe that this will completely change how we view and understand our planet.

We are a bunch of open-minded, multicultural space enthusiasts that are want to work on something that makes us happy to go to work everyday. If you feel the same way, come and talk to us!",stefan@live-eo.com,00491717511774
ODYSSEUS Space,Luxembourg,"Since 2016, ODYSSEUS Space aims at <strong>increasing the flow of goods and information in the Solar System</strong>. For this purpose, the company is developing essentials cost-effective technologies such as <strong>autonomous navigation</strong> and <strong>laser communication</strong> adapted to small satellites. <br /><br />",hr@odysseus.space,
Berlin Space Technologies,"Max-Planck-Straße 3, Berlin, 12489, Germany",,,
Kepler Communications,"Toronto, ON, Canada","At Kepler, we are building the internet in space. But ultimately, the people that make up our team are hobbyists, we are inquisitive, we tinker, we look at how the world is and question how we can make it better. We believe in providing the autonomy and resources to ensure complete product ownership from inception to execution. We believe in maintaining an environment of open communications, with no egos across all roles. And most importantly, we believe in unrelenting improvement. At Kepler, every day brings new challenges, new skills to learn. This is an environment where better always trumps good enough.",smuir@kepler.space,4375375371 x208
Vitrociset Belgium,"Rue Devant les Hêtres 2, 6890 Transinne (Belgique)","More than 30 years of experience in the field of Space Operations Service &amp; Engineering activities, providing a significant contributions to most major Space programmes of the European Space Agency. We work on the ground to build bridges into space, contributing to the success of ambitious missions.
",jobs@vitrocisetbelgium.com,
Progressive Systems,"Via Enrico Fermi, 62, 00044 Frascati RM, Italy","Progressive Systems delivers IT and Consulting services to support Research, Innovation and Projects for Earth Observation﻿ and Environmental Monitoring and Management, as well as Communication and Outreach services to support public access to scientific knowledge and culture.
We aim at delivering excellence in these areas to provide our customers with optimal solutions for their business objectives. 
Our customers benefit from our capacity for understanding their objectives, and for designing, implementing and managing proper processes to achieve such objectives. Our customers benefit as well from our capacity for bridging and for promoting sustainable innovation, and from our competitive solutions. ",careers@progressivesystems.it,+39-06-94801959
Micro IT,"London, UK","Founded in 2013, we have fast become one of the UK’s leading recruitment agencies, specialising in IT and Digital Recruitment. Our partners range from FTSE 100 clients to the most exciting and innovative international businesses on the planet. We are very careful about the candidates we select and the clients we match them with. We research all of our projects rigorously, carefully matching the right candidate to the right client. Our aim is to offer the finest partnerships going, whether that’s permanent, contract, specialist or freelance.",info@microitglobal.co.uk,+44 020 7205 2284
Delta System Solutions GmbH,"Munich & Berlin, Germany","We are independent aviation systems, safety & reliability specialists. 
Our smart S&R engineering approach ensures innovative products can be certified efficiently (no over-design, no over-testing, no over-maintenance). ",apply@delta-system-solutions.com,
Audacy,"Mountain View, CA, USA","Audacy’s provides always-on / real-time space communications - from launch pad to lunar distance - using a 3 satellite constellation in Medium Earth Orbit, and initially 2 operations centers in San Francisco and Singapore.",info@audacy.space,
Spaceflight,"Seattle, WA, USA","Spaceflight is a premier launch services and mission management provider, offering routine, cost-effective access to space so you can innovate and benefit from a celestial perspective and explore beyond our planet. ",info@spaceflight.com,866.342.9934
Lilium,"Munich, Germany","The group shares the vision of a completely new type of individual transportation and is dedicated to develop and build the world’s first fully electric vertical take-off and landing (VTOL) jet. An estimated range of up to 300 km and a top speed of 300 km/h, along with zero emissions make it the most efficient and eco-friendly individual means of transportation of our time. By providing ultra-redundancy, the Lilium Jet will also set new standards in safety.",,
Mynaric USA,United States,"Mynaric USA is the North American leader in delivering laser communication technologies that seamlessly connect people, governments and businesses. ​ ",career@mynaricusa.com,256-429-9698
OQ TECHNOLOGY,"Luxembourg City, Luxembourg","OQ TECHNOLOGY aims to disrupt the satellite telecommunication industry and provides the world’s first universal plug & play ""Internet-of-Things"" device that can provide connectivity anywhere. We are building a global satellite constellation dedicated for ""Internet-of-Things"" communication.
We serve the Oil & Gas, Maritime, Industry 4.0, and Transport segments particularly for the management and tracking of assets in remote areas. Whether this is digital oilfield applications, offshore monitoring, SCADA applications, asset tracking, fleet management, smart metering or predictive maintenance: We provide you innovative low cost connectivity solution and high value data analytics.
Our wireless technology (developed in collaboration with Luxembourg government and the European Space Agency) is compatible with existing wireless technologies. The modules are plug & play, easy to install, have long battery life, and connect you directly to our or your data cloud.",contact@oqtec.space,+352 20600935
Telespazio Germany GmbH,"Europaplatz 5, Darmstadt, Germany","Telespazio Germany is the first choice aerospace company for IT and engineering solutions and services. With more than 350 employees in Germany we shape the future of aerospace together – and beyond. Our staff play a key role in determining our success through their qualifications, motivation, enthusiasm, different cultural backgrounds and their sense of teamwork. We share our clients' passion for high-technology in the Aerospace domain. We actively pursue transferring this technology to new markets. Every day we face new challenges and, as a result, we evolve. Our trusting work environment, multicultural understanding and fundamental technical expertise form the basis our company culture. Telespazio VEGA Deutschland GmbH is a subsidiary of Telespazio S.p.A. (a Leonardo/ Thales company) which, with its network of 4 space centres, 25 operating sites and 2500 employees around the globe, is one of the world’s leading suppliers of satellite services.  Telespazio is a joint venture between Leonardo (67%) and Thales (33%) and is headquartered in Rome, Italy. Telespazio is a world leader in Geoinformation Services, Satellite Systems &amp; Operations and Satellite Communications and operated worldwide through several subsidiaries.",recruitment@telespazio.de,+49 (0)6151–8257-0
SpaceKnow Inc.,"Prague, Czechia","Founded in 2013, SpaceKnow, Inc. is an aerospace, Silicon Valley, venture capital-backed startup. SpaceKnow works by bringing transparency to the global economy by tracking global economic trends from space through their Analytics-as-a-Service products. The company develops these products for monitoring economic activity for a wide variety of both consumer and enterprise clients.",,
CBK PAN,"Warsaw, Poland","We're scientific research institute, part of Polish Academy of Sciences, devoted to space research in general, as well as, space technology development.
The largest entity of this kind in Poland, with rich and longstanding heritage of delivering space hardware on different celestial bodies.
If science stems from curiosity and engineering stems from practicality, then our goal is to build super useful stuff for humanity to expand our knowledge about universe... and ask even more questions! ",rgraczyk@cbk.waw.pl,+48224966397
ICEYE,"Espoo, Finland","ICEYE empowers others to make better decisions in governmental and commercial industries by providing access to timely and reliable satellite imagery. The company is tackling this crucial lack of actionable information with world-first aerospace capabilities and a New Space approach. ICEYE’s radar satellite imaging service, with coverage of selected areas every few hours, both day and night, helps clients resolve challenges in sectors such as maritime, disaster management, insurance, finance, security, and intelligence. ",,
Deep Space Industries,"San Jose, CA, USA","For almost 60 years, NASA dominated space and inspired generations, but when they relinquished low Earth orbit to private companies like SpaceX and Planet Labs, a revolution began. Fast-moving startups have increased innovation and lowered costs in unprecedented ways. But no private company has ventured on its own into the largest potential market, deep space. 

At Deep Space Industries, we are building a new type of spacecraft that drives down the cost of access to deep space as much as 50x lower than current solutions. Our spacecraft gives private companies and government agencies low-cost access to high-Earth orbits, Lunar orbits, near Earth asteroids, Venus, and even Mars, helping to unlock commercial opportunities in the largest segment of the space market. 

In pushing the limits of technology to new frontiers, we intend to help unlock watershed insights and new resources throughout the inner solar system. Our initial focus will be powering scientific, exploratory, commercial, and government missions using our Xplorer spacecraft. As commercial space activities proliferate, we will employ our technology to conduct asteroid science and exploration, support activities such as manufacturing in space, and enter other lucrative vertical markets.",careers@deepspaceindustries.com,855-855-7755
VisionSpace Technologies GmbH,"Darmstadt, Germany","VisionSpace is a NewSpace company developing enterprise-grade software solutions for science and commercial satellite missions. We are a reliable and experienced partner for satellite and ground station monitoring and control systems, using automation and artificial intelligence applications. ",hello@visionspace.com,+49 6151 62 922 70
OHB-System AG,"Bremen, Germany & Oberpfaffenhofen, Germany","3,2,1, lift off...

At OHB System AG, you will be part of one of the most successful European space companies. Some 2,800 committed people work on technological projects of the future within the OHB Group in Germany, France, Italy, Belgium, Sweden and Luxembourg. We are on an expansionary course and always interested in further well-qualified staff for our two strong facilities in Bremen and Oberpfaffenhofen.

At OHB you will find an efficient corporate structure with flat hierarchies and short decision-making routes, giving you the scope for enhancing your personal and professional development. By working in international multi-discipline project teams, you will enjoy a high degree of scope for creativity, independence and self-initiative. You will be able to tap your creative potential in various technologically advanced projects.

We look forward to benefiting from your ideas, commitment, stamina, flexibility, team spirit and dedication. We invite you to send us your application today and to join us in working on some of the most revolutionary space projects of our times.",info@ohb.de,
Space Individuals,"Vienna, Austria",We want to offer our support to the space industry by connecting those who long to explore space with those companies that will make it happen. This is what drives us to develop our platform. If you are one of the people ready to face the final frontier — we're there for you.,welcome@spaceindividuals.com,
Honeybee Robotics,"Longmont, CO, USA","Since 1983 Honeybee Robotics has been creating the world’s most advanced robotics systems for the world’s toughest environments. With projects ranging from Planetary Exploration to Open-Source Software and Spacecraft Systems, Honeybee Robotics has exciting opportunities in a wide variety of Research and Development fields.  With locations in Longmont CO, Pasadena CA and Brooklyn NY, we offer impactful career opportunities coast to coast.",kmschielke@honeybeerobotics.com,
Analytical Space,"Boston, MA, USA","Analytical Space, Inc. (ASI) is a venture-backed startup developing a network of small satellites that use a combination of RF and laser communication to provide global data relay services. The network will connect remote sensing satellites while they would otherwise be idle, such as over the ocean, enabling greater data throughput and lower latency. The company has completed and just launched its first satellite, which is roughly the size of a shoebox, and is now moving to support initial operations, plan future satellites and continue exploring new business development opportunities.

Backed by MIT’s The Engine, Flybridge and other top-tier investors, ASI was founded by Harvard Business School graduates with deep experience in space policy and technology development. The team's background includes careers and stints at NASA, the White House, MIT, CalTech, Florida Tech, and Harvard. The company is advised by a blue ribbon advisory committee comprised of space, government and commercial veterans.",david.payne@analyticalspace.com,
WGS Workgroup Solutions GmbH,"Darmstadt, Germany","WGS Workgroup Solutions GmbH is a German company founded in 2013 and based in Darmstadt (Germany). WGS is focused in providing excellent engineering and consulting services to European companies and institutions in the space sector. Its team consists of highly skilled and motivated professionals with many years of experience in their respective fields.

The company is currently running several Consultancy and Services contracts for our main customer, EUMETSAT, in Germany.
WGS was awarded a Frame Contract in the Astrodynamics Domain by ESA/ESOC and runs operations in the Netherlands for our customer ESA/ESTEC.
WGS runs a consultancy service at the European Southern Observatory (ESO) near Munich.",info@workgroup-solutions.com,
Spire,"San Francisco, Boulder, Glasgow, Singapore, Luxembourg","Spire is a satellite-powered data company that tackles the world’s most unpredictable business challenges with truly global data solutions. By providing unique data from any point on Earth, every hour, Spire offers a competitive advantage for organizations that require insight into areas such as global trade, weather, shipping and supply chain, illegal fishing, and maritime domain awareness.",,
Rocket Lab,"Huntington Beach, CA, USA","Rocket Lab’s mission is to remove the barriers to commercial space by providing frequent launch opportunities to low Earth orbit. Since its creation in 2006 by Peter Beck, Rocket Lab has delivered a range of complete rocket systems and technologies for fast and affordable payload deployment.

Rocket Lab is a private company, with major investors including Khosla Ventures, Bessemer Venture Partners, Data Collective, Promus Ventures, Lockheed Martin and K1W1.",careers@rocketlab.co.nz,
UbiquitiLink Inc,"Falls Church, VA, USA","UbiquitiLink is a space communications venture with a novel idea for a constellation of nanosatellites dedicated to narrowband IoT/M2M communications. Founded by experienced commercial space entrepreneurs, the company is looking for an RF/Electrical Engineer who can support the venture’s efforts to build out and test the key technologies related to the firm’s space and ground payloads. If you love working with SDRs, Antennas, single-board computers, FPGAs, GPUs, CPUs, and SoCs, then you should come help UbiquitiLink build the most novel communications system the world has ever seen.",careers@ubiquitilink.com,
